{
    "ir_version": "1.0.0",
    "generated_at": "2026-02-26T00:00:00Z",
    "app": {
      "entry_file": "fixtures/streamlit_hf_equity_screener/app.py",
      "framework": "streamlit",
      "streamlit_version": "1.31.0",
      "python_version": "3.11",
      "dependencies": ["numpy", "pandas", "streamlit"],
      "env_vars": [],
      "repo": {
        "source": "upload",
        "ref": "fixture",
        "commit": "fixture"
      }
    },
    "ui_tree": [
      {
        "id": "ui_ctr_sidebar",
        "kind": "container",
        "container_type": "sidebar",
        "children": [
          {
            "id": "ui_inp_universe",
            "kind": "input",
            "widget": "selectbox",
            "label": "Universe",
            "binds_to": "universe",
            "data_type": "string",
            "default": null,
            "source_span": {
              "file": "fixtures/streamlit_hf_equity_screener/app.py",
              "line_start": 98,
              "line_end": 98
            }
          },
          {
            "id": "ui_inp_max_names",
            "kind": "input",
            "widget": "slider",
            "label": "Max names (top-N)",
            "binds_to": "max_names",
            "data_type": "number",
            "default": null,
            "source_span": {
              "file": "fixtures/streamlit_hf_equity_screener/app.py",
              "line_start": 99,
              "line_end": 99
            }
          },
          {
            "id": "ui_inp_lookback_days",
            "kind": "input",
            "widget": "slider",
            "label": "Momentum lookback (days)",
            "binds_to": "lookback_days",
            "data_type": "number",
            "default": null,
            "source_span": {
              "file": "fixtures/streamlit_hf_equity_screener/app.py",
              "line_start": 100,
              "line_end": 100
            }
          },
          {
            "id": "ui_inp_start_date",
            "kind": "input",
            "widget": "date_input",
            "label": "Start date",
            "binds_to": "start_date",
            "data_type": "date",
            "default": null,
            "source_span": {
              "file": "fixtures/streamlit_hf_equity_screener/app.py",
              "line_start": 102,
              "line_end": 102
            }
          },
          {
            "id": "ui_inp_end_date",
            "kind": "input",
            "widget": "date_input",
            "label": "End date",
            "binds_to": "end_date",
            "data_type": "date",
            "default": null,
            "source_span": {
              "file": "fixtures/streamlit_hf_equity_screener/app.py",
              "line_start": 103,
              "line_end": 103
            }
          },
          {
            "id": "ui_inp_value_weight",
            "kind": "input",
            "widget": "slider",
            "label": "Value",
            "binds_to": "value_weight",
            "data_type": "number",
            "default": null,
            "source_span": {
              "file": "fixtures/streamlit_hf_equity_screener/app.py",
              "line_start": 106,
              "line_end": 106
            }
          },
          {
            "id": "ui_inp_momentum_weight",
            "kind": "input",
            "widget": "slider",
            "label": "Momentum",
            "binds_to": "momentum_weight",
            "data_type": "number",
            "default": null,
            "source_span": {
              "file": "fixtures/streamlit_hf_equity_screener/app.py",
              "line_start": 107,
              "line_end": 107
            }
          },
          {
            "id": "ui_inp_quality_weight",
            "kind": "input",
            "widget": "slider",
            "label": "Quality",
            "binds_to": "quality_weight",
            "data_type": "number",
            "default": null,
            "source_span": {
              "file": "fixtures/streamlit_hf_equity_screener/app.py",
              "line_start": 108,
              "line_end": 108
            }
          },
          {
            "id": "ui_inp_run",
            "kind": "input",
            "widget": "checkbox",
            "label": "Run screen",
            "binds_to": "run",
            "data_type": "boolean",
            "default": null,
            "source_span": {
              "file": "fixtures/streamlit_hf_equity_screener/app.py",
              "line_start": 110,
              "line_end": 110
            }
          }
        ],
        "source_span": {
          "file": "fixtures/streamlit_hf_equity_screener/app.py",
          "line_start": 94,
          "line_end": 111
        }
      },
      {
        "id": "ui_ctr_main",
        "kind": "container",
        "container_type": "main",
        "children": [
          {
            "id": "ui_out_screen_table",
            "kind": "output",
            "widget": "dataframe",
            "source": "screen",
            "source_span": {
              "file": "fixtures/streamlit_hf_equity_screener/app.py",
              "line_start": 133,
              "line_end": 133
            }
          },
          {
            "id": "ui_out_equity_curve",
            "kind": "output",
            "widget": "chart",
            "source": "equity",
            "source_span": {
              "file": "fixtures/streamlit_hf_equity_screener/app.py",
              "line_start": 138,
              "line_end": 138
            }
          }
        ]
      }
    ],
    "state": {
      "inputs": {
        "universe": { "data_type": "string", "source": "ui" },
        "max_names": { "data_type": "number", "source": "ui" },
        "lookback_days": { "data_type": "number", "source": "ui" },
        "start_date": { "data_type": "date", "source": "ui" },
        "end_date": { "data_type": "date", "source": "ui" },
        "value_weight": { "data_type": "number", "source": "ui" },
        "momentum_weight": { "data_type": "number", "source": "ui" },
        "quality_weight": { "data_type": "number", "source": "ui" },
        "run": { "data_type": "boolean", "source": "ui" }
      },
      "derived": {
        "screen": {
          "depends_on": [
            "start_date",
            "end_date",
            "lookback_days",
            "value_weight",
            "momentum_weight",
            "quality_weight"
          ],
          "computed_by": "compute_signals"
        },
        "equity": {
          "depends_on": ["screen", "start_date", "end_date"],
          "computed_by": "simple_backtest"
        }
      },
      "session": {}
    },
    "compute_graph": [
      {
        "id": "cg_fn_make_market_data",
        "kind": "function",
        "source_span": {
          "file": "fixtures/streamlit_hf_equity_screener/app.py",
          "line_start": 10,
          "line_end": 44
        },
        "inputs": [],
        "outputs": ["prices_long", "fundamentals"],
        "side_effects": [],
        "candidate_for_backend": true
      },
      {
        "id": "cg_fn_compute_signals",
        "kind": "function",
        "source_span": {
          "file": "fixtures/streamlit_hf_equity_screener/app.py",
          "line_start": 47,
          "line_end": 86
        },
        "inputs": [
          "prices_long",
          "fundamentals",
          "start_dt",
          "end_dt",
          "lookback_days",
          "value_weight",
          "momentum_weight",
          "quality_weight"
        ],
        "outputs": ["screen"],
        "side_effects": [],
        "candidate_for_backend": true
      },
      {
        "id": "cg_fn_simple_backtest",
        "kind": "function",
        "source_span": {
          "file": "fixtures/streamlit_hf_equity_screener/app.py",
          "line_start": 89,
          "line_end": 116
        },
        "inputs": ["prices_long", "picks", "start_dt", "end_dt"],
        "outputs": ["equity"],
        "side_effects": [],
        "candidate_for_backend": true
      }
    ],
    "backend_plan": {
      "endpoints": [
        {
          "name": "run_screen",
          "method": "POST",
          "path": "/api/run_screen",
          "source_function": "cg_fn_compute_signals",
          "request_schema": "RunScreenRequest",
          "response_schema": "RunScreenResponse"
        },
        {
          "name": "run_backtest",
          "method": "POST",
          "path": "/api/run_backtest",
          "source_function": "cg_fn_simple_backtest",
          "request_schema": "RunBacktestRequest",
          "response_schema": "RunBacktestResponse"
        }
      ],
      "schemas": {
        "RunScreenRequest": {
          "start_date": "date",
          "end_date": "date",
          "lookback_days": "number",
          "value_weight": "number",
          "momentum_weight": "number",
          "quality_weight": "number"
        },
        "RunScreenResponse": {
          "rows": "List[Dict]",
          "columns": "List[String]"
        },
        "RunBacktestRequest": {
          "picks": "List[String]",
          "start_date": "date",
          "end_date": "date"
        },
        "RunBacktestResponse": {
          "points": "List[Dict]"
        }
      }
    },
    "assets": {
      "models": [],
      "data_sources": []
    },
    "warnings": [
      {
        "severity": "low",
        "category": "unsupported",
        "message": "st.columns detected (layout-only). Treat as main container children in v1.",
        "suggestion": "Generators may ignore columns or render metrics in a simple grid.",
        "source_span": {
          "file": "fixtures/streamlit_hf_equity_screener/app.py",
          "line_start": 125,
          "line_end": 125
        }
      }
    ]
  }